{"operation":"DATASET_TRANSFORM","inputArtifactIds":["00000000-0000-4000-8000-000000000103"],"datasetArtifacts":[{"artifactId":"00000000-0000-4000-8000-000000000701","artifactClass":"STAGING","role":"PARQUET","key":"staging/00000000-0000-4000-8000-000000000303/00000000-0000-4000-8000-000000000403/data.parquet","mediaType":"application/vnd.apache.parquet","byteLength":2048,"checksumAlgorithm":"SHA256","checksum":"5555555555555555555555555555555555555555555555555555555555555555","immutable":false,"createdAt":"2026-07-15T00:00:03.000Z"}],"schemaArtifact":{"artifactId":"00000000-0000-4000-8000-000000000702","artifactClass":"STAGING","role":"STRUCTURED","key":"staging/00000000-0000-4000-8000-000000000303/00000000-0000-4000-8000-000000000403/schema.json","mediaType":"application/json","byteLength":256,"checksumAlgorithm":"SHA256","checksum":"6666666666666666666666666666666666666666666666666666666666666666","immutable":false,"createdAt":"2026-07-15T00:00:03.000Z"},"statisticsArtifact":{"artifactId":"00000000-0000-4000-8000-000000000703","artifactClass":"STAGING","role":"STRUCTURED","key":"staging/00000000-0000-4000-8000-000000000303/00000000-0000-4000-8000-000000000403/statistics.json","mediaType":"application/json","byteLength":256,"checksumAlgorithm":"SHA256","checksum":"7777777777777777777777777777777777777777777777777777777777777777","immutable":false,"createdAt":"2026-07-15T00:00:03.000Z"},"manifestArtifact":{"artifactId":"00000000-0000-4000-8000-000000000704","artifactClass":"STAGING","role":"MANIFEST","key":"staging/00000000-0000-4000-8000-000000000303/00000000-0000-4000-8000-000000000403/manifest.json","mediaType":"application/json","byteLength":256,"checksumAlgorithm":"SHA256","checksum":"8888888888888888888888888888888888888888888888888888888888888888","immutable":false,"createdAt":"2026-07-15T00:00:03.000Z"},"rowCount":100,"columnCount":4,"partitionCount":1,"schemaFingerprint":"9999999999999999999999999999999999999999999999999999999999999999","nullCount":2,"rejectedRowCount":0,"sourceSheets":[],"warnings":[],"metrics":{"wallTimeMs":3000,"peakMemoryBytes":2000000,"bytesRead":4096,"bytesWritten":2816},"derivation":{"inputChecksums":["4444444444444444444444444444444444444444444444444444444444444444"],"provider":{"providerId":"reference.dataset","providerVersion":"1.0.0","adapterVersion":"1.0.0"},"optionsDigest":"aaaaaaaaaaaaaaaaaaaaaaaaaaaaaaaaaaaaaaaaaaaaaaaaaaaaaaaaaaaaaaaa","modelDigests":[]}}
